{
  "$schema": "https://loxtep.io/schemas/transformation-package-v1.json",
  "template_type": "transform",
  "slug": "explode-array",
  "name": "Explode Array",
  "description": "Converts array elements into separate events/rows",
  "version": "1.1.0",
  "tags": [
    "data-manipulation",
    "array",
    "expand"
  ],
  "use_cases": [
    "Split order line items into individual rows",
    "Expand nested arrays for per-item analytics",
    "Fan out multi-value events for downstream processing"
  ],
  "entity_type": "transformations",
  "entity": {
    "transformation_id": "{{TRANSFORMATION_ID}}",
    "organization_id": "{{ORGANIZATION_ID}}",
    "project_id": "{{PROJECT_ID}}",
    "workflow_id": "{{WORKFLOW_ID}}",
    "name": "{{NAME}}",
    "transform_type": "explode_array",
    "operation_config": {
      "field": "items",
      "include_original": true,
      "on_empty": "drop"
    },
    "created_at": "{{CREATED_AT}}",
    "updated_at": "{{UPDATED_AT}}"
  },
  "placeholders": {
    "{{TRANSFORMATION_ID}}": "Generated UUID for the transformation",
    "{{ORGANIZATION_ID}}": "Organization that owns this transformation",
    "{{PROJECT_ID}}": "Project that contains this transformation",
    "{{WORKFLOW_ID}}": "Workflow this transformation belongs to",
    "{{NAME}}": "User-provided name for the transformation",
    "{{CREATED_AT}}": "ISO 8601 timestamp",
    "{{UPDATED_AT}}": "ISO 8601 timestamp"
  }
}
