{
  "$schema": "https://loxtep.io/schemas/transformation-package-v1.json",
  "template_type": "transform",
  "slug": "formatter",
  "name": "Formatter",
  "description": "Formats data using templates",
  "version": "1.0.0",
  "tags": [
    "utilities",
    "template",
    "string"
  ],
  "use_cases": [
    "Generate templated messages or labels",
    "Build formatted output strings from multiple fields",
    "Create human-readable summaries from event data"
  ],
  "entity_type": "transformations",
  "entity": {
    "transformation_id": "{{TRANSFORMATION_ID}}",
    "organization_id": "{{ORGANIZATION_ID}}",
    "project_id": "{{PROJECT_ID}}",
    "workflow_id": "{{WORKFLOW_ID}}",
    "name": "{{NAME}}",
    "transform_type": "formatter",
    "operation_config": {
      "template": "Hello {{name}}",
      "output_field": "greeting"
    },
    "created_at": "{{CREATED_AT}}",
    "updated_at": "{{UPDATED_AT}}"
  },
  "placeholders": {
    "{{TRANSFORMATION_ID}}": "Generated UUID for the transformation",
    "{{ORGANIZATION_ID}}": "Organization that owns this transformation",
    "{{PROJECT_ID}}": "Project that contains this transformation",
    "{{WORKFLOW_ID}}": "Workflow this transformation belongs to",
    "{{NAME}}": "User-provided name for the transformation",
    "{{CREATED_AT}}": "ISO 8601 timestamp",
    "{{UPDATED_AT}}": "ISO 8601 timestamp"
  }
}
