{
  "$schema": "https://loxtep.io/schemas/transformation-package-v1.json",
  "template_type": "transform",
  "slug": "assign-identifier",
  "name": "Assign Identifier",
  "description": "Adds identifier to each event",
  "version": "1.0.0",
  "tags": [
    "utilities",
    "id",
    "uuid"
  ],
  "use_cases": [
    "Generate unique event IDs for deduplication",
    "Add correlation IDs for tracing",
    "Assign surrogate keys to records"
  ],
  "entity_type": "transformations",
  "entity": {
    "transformation_id": "{{TRANSFORMATION_ID}}",
    "organization_id": "{{ORGANIZATION_ID}}",
    "project_id": "{{PROJECT_ID}}",
    "workflow_id": "{{WORKFLOW_ID}}",
    "name": "{{NAME}}",
    "transform_type": "assign_identifier",
    "operation_config": {
      "field": "event_id",
      "type": "uuid"
    },
    "created_at": "{{CREATED_AT}}",
    "updated_at": "{{UPDATED_AT}}"
  },
  "placeholders": {
    "{{TRANSFORMATION_ID}}": "Generated UUID for the transformation",
    "{{ORGANIZATION_ID}}": "Organization that owns this transformation",
    "{{PROJECT_ID}}": "Project that contains this transformation",
    "{{WORKFLOW_ID}}": "Workflow this transformation belongs to",
    "{{NAME}}": "User-provided name for the transformation",
    "{{CREATED_AT}}": "ISO 8601 timestamp",
    "{{UPDATED_AT}}": "ISO 8601 timestamp"
  }
}
