{
  "$schema": "https://loxtep.io/schemas/transformation-package-v1.json",
  "template_type": "transform",
  "slug": "crypto",
  "name": "Crypto",
  "description": "Encrypts/decrypts fields",
  "version": "1.0.0",
  "tags": [
    "utilities",
    "encryption",
    "security"
  ],
  "use_cases": [
    "Encrypt PII fields before storage",
    "Tokenize sensitive data for compliance",
    "Decrypt fields for authorized consumers"
  ],
  "entity_type": "transformations",
  "entity": {
    "transformation_id": "{{TRANSFORMATION_ID}}",
    "organization_id": "{{ORGANIZATION_ID}}",
    "project_id": "{{PROJECT_ID}}",
    "workflow_id": "{{WORKFLOW_ID}}",
    "name": "{{NAME}}",
    "transform_type": "crypto",
    "operation_config": {
      "field": "ssn",
      "operation": "encrypt",
      "algorithm": "aes-256-gcm",
      "key": "key-id"
    },
    "created_at": "{{CREATED_AT}}",
    "updated_at": "{{UPDATED_AT}}"
  },
  "placeholders": {
    "{{TRANSFORMATION_ID}}": "Generated UUID for the transformation",
    "{{ORGANIZATION_ID}}": "Organization that owns this transformation",
    "{{PROJECT_ID}}": "Project that contains this transformation",
    "{{WORKFLOW_ID}}": "Workflow this transformation belongs to",
    "{{NAME}}": "User-provided name for the transformation",
    "{{CREATED_AT}}": "ISO 8601 timestamp",
    "{{UPDATED_AT}}": "ISO 8601 timestamp"
  }
}
